<!DOCTYPE etl SYSTEM "http://scriptella.org/dtd/etl.dtd">
<etl>
    <connection driver="org.h2.Driver" url="jdbc:h2:mem:nestedElements;MODE=LEGACY;NON_KEYWORDS=VALUE" user="sa"/>
    <script>
        CREATE TABLE Test (
        ID INT
        );
        INSERT INTO TEST VALUES (1);
        INSERT INTO TEST VALUES (2);
        INSERT INTO TEST VALUES (3);
        INSERT INTO TEST VALUES (4);
        INSERT INTO TEST VALUES (5);
        INSERT INTO TEST VALUES (6);
        INSERT INTO TEST VALUES (7);
        INSERT INTO TEST VALUES (8);
        INSERT INTO TEST VALUES (9);
        INSERT INTO TEST VALUES (10);
    </script>
    <query>
        SELECT * FROM Test
        <query>
            SELECT * FROM Test
            <query>
                SELECT * FROM Test
                <query>
                    SELECT * FROM Test
                    <script>
                        UPDATE TEST SET id=100 where id=-1;
                    </script>
                </query>

            </query>
        </query>
    </query>
    <query>
        SELECT * FROM Test
        <query>
            SELECT * FROM Test
            <query>
                SELECT * FROM Test
                <query>
                    SELECT * FROM Test
                    <script>
                        UPDATE TEST SET id=?id where id=-1;
                    </script>
                </query>

            </query>
        </query>


    </query>

    <script>
    </script>


</etl>