<!--
  ~ Copyright 2006-2012 The Scriptella Project Team.
  ~
  ~ Licensed under the Apache License, Version 2.0 (the "License");
  ~ you may not use this file except in compliance with the License.
  ~ You may obtain a copy of the License at
  ~
  ~      http://www.apache.org/licenses/LICENSE-2.0
  ~
  ~ Unless required by applicable law or agreed to in writing, software
  ~ distributed under the License is distributed on an "AS IS" BASIS,
  ~ WITHOUT WARRANTIES OR CONDITIONS OF ANY KIND, either express or implied.
  ~ See the License for the specific language governing permissions and
  ~ limitations under the License.
  -->

<!DOCTYPE etl SYSTEM "http://scriptella.javaforge.com/dtd/etl.dtd">
<etl>
    <connection id="db" driver="hsqldb" url="jdbc:hsqldb:mem:text" user="sa" password=""/>

    <connection id="text" driver="text" url="tst://testfile">
        format.2.trim=true
        format.Text.trim=true
        format.DateCol.type=date
        format.DateCol.pattern=dd-MM-yyyy HH:mm
        #4 column mapped to DateCol
        format.4.type=date
        format.4.pattern=dd-MM-yyyy HH:mm
        format.NumCol.type=number
        format.NumCol.trim=true
        format.NumCol.pattern=#.00
        format.NumCol.null_string=-null-
        #5 column mapped to NumCol
        format.column5.type=number
        format.column5.pattern=#.00
        format.column5.null_string=-null-
    </connection>

    <script connection-id="db">
        <!-- Test data -->
        CREATE TABLE Test (
            ID INT,
            Text VARCHAR(100),
            TextNoTrim VARCHAR(100),
            DateCol TIMESTAMP,
            NumCol DECIMAL
        );
        INSERT INTO Test VALUES(1, 'One', 'One', {ts '2012-07-11 22:33:44.1'}, null);
        INSERT INTO Test VALUES(2, ' Two ', ' Two ', {ts '2012-07-11 20:00:00'}, 2.1);
        INSERT INTO Test VALUES(3, ' Three ', ' Three ', {ts '2012-07-11 20:00:00'}, 3.1);
        CREATE TABLE TestAlias (
            NumCol DECIMAL
        );
    </script>

    <!-- Reads input and inserts into a Test table. column format rules are used to parse values -->
    <query connection-id="text">
        ([\d]+),([^,]*),([^,]*),([^,]*),([^,]*)
        <script connection-id="db">
            INSERT INTO Test VALUES(?1, ?2, ?3, ?4, ?column5); <!-- ?column5=?5 -->
        </script>
    </query>


    <!-- Export DB to a CSV file -->
    <query connection-id="db">
        SELECT * FROM Test
        <script connection-id="text">
            $Id/$Text/$TextNoTrim/$DateCol/$NumCol
        </script>
    </query>

</etl>