<!DOCTYPE etl SYSTEM "http://scriptella.org/dtd/etl.dtd">
<etl>
    <description>
        Migrates data from LDAP to Database.
        Creates users and roles tables suitable for Tomcat JDBCRealm authentication.
        The source data is obtained from LDAP.
    </description>
    <!--Connection to the LDAP-->
    <connection id="in" url="ldap://localhost:389/dc=scriptella"
                user="cn=root,dc=scriptella" password="secret">
        <!--Define connection properties-->
        search.scope=subtree
    </connection>
    <!--Connection to the target database -->
    <connection id="out" url="jdbc:h2:./outdb"
                user="sa" password="" classpath="../lib/h2.jar"/>
    <script connection-id="out">
        <!--Creates empty database and drops exisiting tables if DB already exisis -->
        <include href="dbschema.sql"/>
    </script>
    <query connection-id="in">
        <!--Selects users(user attributes) from ou=people,dc=scriptella-->
        (objectClass=inetOrgPerson)
        <script connection-id="out">
            <!--Inserts user record using parameters from the outer query result set-->
            <!--Please note that userPassword is just a hash of the original value-->
            INSERT INTO Users VALUES (?uid, ?userPassword);
        </script>
        <!--Additionally we need to query a list of groups containing found user-->
        <query>
            <![CDATA[(&(objectClass=groupOfUniqueNames)(uniqueMember=$dn))]]>
            <!-- For each group in the query result set-->
            <script connection-id="out">
                <!--Insert User_Role record into database-->
                INSERT INTO User_Roles VALUES (?uid, ?cn);
            </script>
        </query>
    </query>
</etl>
