<!DOCTYPE etl SYSTEM "http://scriptella.org/dtd/etl.dtd">
<etl>
    <description>Database upgrade/downgrade script</description>
    <properties>
        <include href="dbupdate.properties"/>
    </properties>
    <connection driver="${driver}" url="${url}" user="${user}" password="${password}"/>
    <!-- Upgrade scripts -->
    <script if="version.from==1 and version.to ge 2"><!--Upgrading from v1 to v2 -->
        <include href="1-2.sql"/>
    </script>
    <script if="version.to>version.from and version.to==3"> <!--Upgrading from v1 or v2 to v3 -->
        <include href="2-3.sql"/>
    </script>

    <!-- Downgrade scripts. This is not a common practise, but we've shown it also -->
    <script if="version.from>version.to and version.from==3"> <!--Downgrading from v3 to v2-->
        <include href="3-2.sql"/>
    </script>
    <script if="version.to==1 and version.from>=2"> <!--Downgrading from v2 to v1-->
        <include href="2-1.sql"/>
    </script>

</etl>
