<?xml version="1.0" encoding="UTF-8"?>
<!DOCTYPE etl SYSTEM "http://scriptella.org/dtd/etl.dtd">
<etl>
    <properties>
        <include href="etl.properties"/>
    </properties>
    <connection id="source" url="$source.url"/>
    <connection id="target" url="$target.url"/>
    <query connection-id="source">
        <include href="$query.sql"/>
        <script connection-id="target">
            <include href="$insert.sql"/>
        </script>
    </query>
</etl>
