<!DOCTYPE etl SYSTEM "http://scriptella.org/dtd/etl.dtd">
<etl>
    <connection id="db" driver="h2" url="jdbc:h2:mem:csv;MODE=LEGACY;NON_KEYWORDS=VALUE" user="sa" password="">
    </connection>
    <!--Connection to a test file:
    f1,f2,f3
    1,2,3
    Col4,5,6
    7,8,9-->
    <connection id="csv" driver="csv" url="tst://testfile"/>
    <script connection-id="db">
        <!-- Test data -->
        CREATE TABLE Test (
            ID INT,
            Text VARCHAR(100)
        );
        INSERT INTO Test VALUES(1, 'One');
        INSERT INTO Test VALUES(2, ' ;,-Two" ');
        INSERT INTO Test VALUES(3, ' Three!!,  ');
        CREATE TABLE Result (
            ID INT,
            Text VARCHAR(100)
        );

    </script>
    <query connection-id="csv">
        <!--All rows-->
        <script connection-id="db">INSERT INTO Result VALUES(?rownum, ?f1 || ' ' || ?f2 || ' ' || ?f3)</script>
    </query>
    <query connection-id="csv">
        1,<!--Select rows having 1 in a first column -->
        col4,
        6<!--All rows-->
        <script connection-id="db">INSERT INTO Result VALUES(100+?rownum, 'q' || ?F1)</script>
    </query>

    <query connection-id="db">
        <!-- Produce a report for a query -->
        SELECT * FROM Test
        <script connection-id="csv">
            $id,$text</script>
    </query>

</etl>
