<!DOCTYPE etl SYSTEM "http://scriptella.org/dtd/etl.dtd">
<etl>
    <properties>
        property=!
    </properties>
    <connection id="c1" driver="org.h2.Driver" url="jdbc:h2:mem:nestedquerytestdb1;MODE=LEGACY;NON_KEYWORDS=VALUE" user="sa" password=""/>
    <connection id="c2" driver="org.h2.Driver" url="jdbc:h2:mem:nestedquerytestdb2;MODE=LEGACY;NON_KEYWORDS=VALUE" user="sa" password=""/>
    <script connection-id="c1">
        CREATE TABLE Test (
        ID INT
        );
        insert into Test values (1);
        insert into Test values (3);
    </script>
    <script connection-id="c2">
        CREATE TABLE Test (
        ID INT,
        TEXT VARCHAR(100)
        );
        CREATE TABLE Result (
        ID INT,
        TEXT VARCHAR(100),
        TEXT2 VARCHAR(100)
        );

        insert into Test(id, text) values (1, 'One');
        insert into Test(id, text) values (2, 'Two');
        insert into Test(id, text) values (3, 'Three');
    </script>

    <query connection-id="c1">
        <query connection-id="c2">
            select * from test where id=?{id}
            <script connection-id="c2">
                insert into result(id, text, text2) values (?id,?text,?property || 'tst');
            </script>
        </query>
        select * from test
    </query>


</etl>
