<!DOCTYPE etl SYSTEM "http://scriptella.org/dtd/etl.dtd">
<etl>
    <connection driver="org.h2.Driver" url="jdbc:h2:mem:est;MODE=LEGACY;NON_KEYWORDS=VALUE" user="sa" password=""/>
    <script>
        create table t1 (
        id int
        );
        create table t2 (
        id int
        );
        insert into t1(id) values(1);
        insert into t1(id) values(2);
    </script>
    <query>
        select * from t1
        <query>
            select * from t1 where id=?id
            <script>
                insert into t2 values(?id)
            </script>
        </query>

    </query>
    <script>
        <!--Only H2 dialects are executed-->
        <dialect name="h2">
            COMMIT;<!--Just for test -->
            COMMIT;
        </dialect>
        <dialect name="h2">
        </dialect>
        <dialect name=".*oracle.*">
            Won't execute;
        </dialect>

    </script>


</etl>
